{
  "event_id": "10000000-0000-4000-8000-000000000501",
  "event_type": "course_generation.requested.v1",
  "event_version": 1,
  "producer": "course_generation",
  "tenant_id": "00000000-0000-4000-8000-0000000000a1",
  "aggregate_type": "course_generation_run",
  "aggregate_id": "00000000-0000-4000-8000-00000000d501",
  "source_document_id": "00000000-0000-4000-8000-00000000c301",
  "source_version_id": "00000000-0000-4000-8000-00000000c302",
  "ingestion_run_id": "00000000-0000-4000-8000-00000000c401",
  "course_generation_run_id": "00000000-0000-4000-8000-00000000d501",
  "aggregate_version": 1,
  "occurred_at": "2026-08-31T02:00:00Z",
  "recorded_at": "2026-08-31T02:00:01Z",
  "correlation_id": "30000000-0000-4000-8000-000000000501",
  "causation_id": "40000000-0000-4000-8000-000000000501",
  "privacy_class": "internal",
  "payload": {
    "status": "queued",
    "checkpoint": "created",
    "reason_code": null,
    "input_manifest_sha256": "sha256:aaaaaaaaaaaaaaaaaaaaaaaaaaaaaaaaaaaaaaaaaaaaaaaaaaaaaaaaaaaaaaaa",
    "blueprint_content_sha256": null,
    "output_manifest_sha256": null,
    "attempt_count": 0
  }
}
